{
  "schema_version": "lann-site-neutral-input/v0.1",
  "package_purpose": "Provide source materials and human context to lann-site without defining its analysis output.",
  "project": {
    "id": "site_20260726_sijing",
    "name": "泗泾招商花园城",
    "status": "ready_for_lann_site"
  },
  "provenance": {
    "source_channel": "feishu_bot",
    "chat_id": "oc_shadow_fixture",
    "created_by": "ou_kai_fixture",
    "created_at": "2026-07-26T08:00:00.000Z",
    "updated_at": "2026-07-26T09:00:00.000Z"
  },
  "sources": [
    {
      "source_id": "source-mall-intro",
      "source_kind": "file",
      "original_file_name": "泗泾花园城商场介绍.pdf",
      "message_id": "om_file_01",
      "sender": "ou_kai_fixture",
      "received_at": "2026-07-26T08:05:00.000Z",
      "feishu_resource": {
        "file_key": "fixture-file-key"
      },
      "storage": {
        "sha256": "fixture-sha256",
        "bytes": 123456,
        "mime_type": "application/pdf",
        "relative_path": "blobs/fixture-sha256.pdf"
      },
      "archive_error": null,
      "transcription": null
    },
    {
      "source_id": "source-kai-voice",
      "source_kind": "audio",
      "original_file_name": "王凯补充语音.opus",
      "message_id": "om_audio_01",
      "sender": "ou_kai_fixture",
      "received_at": "2026-07-26T08:10:00.000Z",
      "feishu_resource": {
        "file_key": "fixture-audio-key"
      },
      "storage": {
        "sha256": "fixture-audio-sha256",
        "bytes": 34567,
        "mime_type": "audio/opus",
        "relative_path": "blobs/fixture-audio-sha256.opus"
      },
      "archive_error": null,
      "transcription": {
        "status": "unavailable",
        "text": null,
        "reason": "未配置语音转写模型；音频原文件已安全归集"
      }
    }
  ],
  "user_notes": [
    {
      "message_id": "om_note_01",
      "sender": "ou_kai_fixture",
      "received_at": "2026-07-26T08:15:00.000Z",
      "text": "租金已经明确，目前先做影子分析，不要写入dashboard。"
    }
  ],
  "requested_action": "site_analysis_requested",
  "confirmation": {
    "input_summary_confirmed": true,
    "confirmed_at": "2026-07-26T08:30:00.000Z"
  },
  "external_writes": {
    "dashboard_allowed": false,
    "dashboard_attempted": false
  }
}
